{
  "authorization": {
    "fileMutation": false,
    "localCpaMutation": false,
    "processInspection": false,
    "processTermination": false,
    "serviceRestart": false,
    "sigkill": false
  },
  "automaticAction": false,
  "confirmation": "RETIRE STALE ORPHANED LOCAL CODEXX EXEC PROCESSES",
  "preconditions": [
    "orphan_parent_ppid_one",
    "one_official_codex_child",
    "minimum_thirty_day_age",
    "revoked_standard_io",
    "zero_network_sockets",
    "sustained_cpu_bound_state",
    "decision_digest_match",
    "external_local_cpa_healthy"
  ],
  "schema": "cloudx.stale-local-codexx-exec-plan.v1",
  "status": "confirmation-required"
}
